{
  "branchGroups": [
    {
      "aiStrategyIds": ["synthetic_governance_strategy"],
      "conditional": false,
      "crisis": false,
      "family": "governance",
      "focusIds": [
        "synthetic_route_01_focus_01",
        "synthetic_route_01_focus_02",
        "synthetic_route_01_focus_03",
        "synthetic_route_01_focus_04",
        "synthetic_route_01_focus_05",
        "synthetic_route_01_focus_06",
        "synthetic_route_01_focus_07",
        "synthetic_route_01_focus_08",
        "synthetic_route_01_focus_09",
        "synthetic_route_01_focus_10",
        "synthetic_route_01_focus_11",
        "synthetic_route_01_focus_12",
        "synthetic_route_01_focus_13",
        "synthetic_route_01_focus_14",
        "synthetic_route_01_focus_15",
        "synthetic_route_01_focus_16",
        "synthetic_route_01_focus_17",
        "synthetic_route_01_focus_18",
        "synthetic_route_01_focus_19",
        "synthetic_route_01_focus_20",
        "synthetic_route_01_focus_21",
        "synthetic_route_01_focus_22",
        "synthetic_route_01_focus_23",
        "synthetic_route_01_focus_24",
        "synthetic_route_01_focus_25"
      ],
      "hidden": false,
      "id": "route_01",
      "label": "Governance Route",
      "laneId": "route_01",
      "major": true
    },
    {
      "aiStrategyIds": ["synthetic_diplomacy_strategy"],
      "conditional": false,
      "crisis": false,
      "family": "diplomacy",
      "focusIds": [
        "synthetic_route_02_focus_01",
        "synthetic_route_02_focus_02",
        "synthetic_route_02_focus_03",
        "synthetic_route_02_focus_04",
        "synthetic_route_02_focus_05",
        "synthetic_route_02_focus_06",
        "synthetic_route_02_focus_07",
        "synthetic_route_02_focus_08",
        "synthetic_route_02_focus_09",
        "synthetic_route_02_focus_10",
        "synthetic_route_02_focus_11",
        "synthetic_route_02_focus_12",
        "synthetic_route_02_focus_13",
        "synthetic_route_02_focus_14",
        "synthetic_route_02_focus_15",
        "synthetic_route_02_focus_16",
        "synthetic_route_02_focus_17",
        "synthetic_route_02_focus_18",
        "synthetic_route_02_focus_19",
        "synthetic_route_02_focus_20",
        "synthetic_route_02_focus_21",
        "synthetic_route_02_focus_22",
        "synthetic_route_02_focus_23",
        "synthetic_route_02_focus_24",
        "synthetic_route_02_focus_25"
      ],
      "hidden": false,
      "id": "route_02",
      "label": "Diplomacy Route",
      "laneId": "route_02",
      "major": true
    },
    {
      "aiStrategyIds": ["synthetic_industry_strategy"],
      "conditional": false,
      "crisis": false,
      "family": "industry",
      "focusIds": [
        "synthetic_route_03_focus_01",
        "synthetic_route_03_focus_02",
        "synthetic_route_03_focus_03",
        "synthetic_route_03_focus_04",
        "synthetic_route_03_focus_05",
        "synthetic_route_03_focus_06",
        "synthetic_route_03_focus_07",
        "synthetic_route_03_focus_08",
        "synthetic_route_03_focus_09",
        "synthetic_route_03_focus_10",
        "synthetic_route_03_focus_11",
        "synthetic_route_03_focus_12",
        "synthetic_route_03_focus_13",
        "synthetic_route_03_focus_14",
        "synthetic_route_03_focus_15",
        "synthetic_route_03_focus_16",
        "synthetic_route_03_focus_17",
        "synthetic_route_03_focus_18",
        "synthetic_route_03_focus_19",
        "synthetic_route_03_focus_20",
        "synthetic_route_03_focus_21",
        "synthetic_route_03_focus_22",
        "synthetic_route_03_focus_23",
        "synthetic_route_03_focus_24",
        "synthetic_route_03_focus_25"
      ],
      "hidden": false,
      "id": "route_03",
      "label": "Industry Route",
      "laneId": "route_03",
      "major": true
    },
    {
      "aiStrategyIds": ["synthetic_army_strategy"],
      "conditional": false,
      "crisis": false,
      "family": "army",
      "focusIds": [
        "synthetic_route_04_focus_01",
        "synthetic_route_04_focus_02",
        "synthetic_route_04_focus_03",
        "synthetic_route_04_focus_04",
        "synthetic_route_04_focus_05",
        "synthetic_route_04_focus_06",
        "synthetic_route_04_focus_07",
        "synthetic_route_04_focus_08",
        "synthetic_route_04_focus_09",
        "synthetic_route_04_focus_10",
        "synthetic_route_04_focus_11",
        "synthetic_route_04_focus_12",
        "synthetic_route_04_focus_13",
        "synthetic_route_04_focus_14",
        "synthetic_route_04_focus_15",
        "synthetic_route_04_focus_16",
        "synthetic_route_04_focus_17",
        "synthetic_route_04_focus_18",
        "synthetic_route_04_focus_19",
        "synthetic_route_04_focus_20",
        "synthetic_route_04_focus_21",
        "synthetic_route_04_focus_22",
        "synthetic_route_04_focus_23",
        "synthetic_route_04_focus_24",
        "synthetic_route_04_focus_25"
      ],
      "hidden": false,
      "id": "route_04",
      "label": "Army Route",
      "laneId": "route_04",
      "major": true
    },
    {
      "aiStrategyIds": ["synthetic_air_strategy"],
      "conditional": false,
      "crisis": false,
      "family": "air",
      "focusIds": [
        "synthetic_route_05_focus_01",
        "synthetic_route_05_focus_02",
        "synthetic_route_05_focus_03",
        "synthetic_route_05_focus_04",
        "synthetic_route_05_focus_05",
        "synthetic_route_05_focus_06",
        "synthetic_route_05_focus_07",
        "synthetic_route_05_focus_08",
        "synthetic_route_05_focus_09",
        "synthetic_route_05_focus_10",
        "synthetic_route_05_focus_11",
        "synthetic_route_05_focus_12",
        "synthetic_route_05_focus_13",
        "synthetic_route_05_focus_14",
        "synthetic_route_05_focus_15",
        "synthetic_route_05_focus_16",
        "synthetic_route_05_focus_17",
        "synthetic_route_05_focus_18",
        "synthetic_route_05_focus_19",
        "synthetic_route_05_focus_20",
        "synthetic_route_05_focus_21",
        "synthetic_route_05_focus_22",
        "synthetic_route_05_focus_23",
        "synthetic_route_05_focus_24",
        "synthetic_route_05_focus_25"
      ],
      "hidden": false,
      "id": "route_05",
      "label": "Air Route",
      "laneId": "route_05",
      "major": true
    },
    {
      "aiStrategyIds": ["synthetic_navy_strategy"],
      "conditional": false,
      "crisis": false,
      "family": "navy",
      "focusIds": [
        "synthetic_route_06_focus_01",
        "synthetic_route_06_focus_02",
        "synthetic_route_06_focus_03",
        "synthetic_route_06_focus_04",
        "synthetic_route_06_focus_05",
        "synthetic_route_06_focus_06",
        "synthetic_route_06_focus_07",
        "synthetic_route_06_focus_08",
        "synthetic_route_06_focus_09",
        "synthetic_route_06_focus_10",
        "synthetic_route_06_focus_11",
        "synthetic_route_06_focus_12",
        "synthetic_route_06_focus_13",
        "synthetic_route_06_focus_14",
        "synthetic_route_06_focus_15",
        "synthetic_route_06_focus_16",
        "synthetic_route_06_focus_17",
        "synthetic_route_06_focus_18",
        "synthetic_route_06_focus_19",
        "synthetic_route_06_focus_20",
        "synthetic_route_06_focus_21",
        "synthetic_route_06_focus_22",
        "synthetic_route_06_focus_23",
        "synthetic_route_06_focus_24",
        "synthetic_route_06_focus_25"
      ],
      "hidden": false,
      "id": "route_06",
      "label": "Navy Route",
      "laneId": "route_06",
      "major": true
    },
    {
      "aiStrategyIds": ["synthetic_intelligence_strategy"],
      "conditional": true,
      "crisis": false,
      "family": "intelligence",
      "focusIds": [
        "synthetic_route_07_focus_01",
        "synthetic_route_07_focus_02",
        "synthetic_route_07_focus_03",
        "synthetic_route_07_focus_04",
        "synthetic_route_07_focus_05",
        "synthetic_route_07_focus_06",
        "synthetic_route_07_focus_07",
        "synthetic_route_07_focus_08",
        "synthetic_route_07_focus_09",
        "synthetic_route_07_focus_10",
        "synthetic_route_07_focus_11",
        "synthetic_route_07_focus_12",
        "synthetic_route_07_focus_13",
        "synthetic_route_07_focus_14",
        "synthetic_route_07_focus_15",
        "synthetic_route_07_focus_16",
        "synthetic_route_07_focus_17",
        "synthetic_route_07_focus_18",
        "synthetic_route_07_focus_19",
        "synthetic_route_07_focus_20",
        "synthetic_route_07_focus_21",
        "synthetic_route_07_focus_22",
        "synthetic_route_07_focus_23",
        "synthetic_route_07_focus_24",
        "synthetic_route_07_focus_25"
      ],
      "hidden": false,
      "id": "route_07",
      "label": "Intelligence Route",
      "laneId": "route_07",
      "major": true
    },
    {
      "aiStrategyIds": ["synthetic_shadow_strategy"],
      "conditional": false,
      "crisis": false,
      "family": "shadow",
      "focusIds": [
        "synthetic_route_08_focus_01",
        "synthetic_route_08_focus_02",
        "synthetic_route_08_focus_03",
        "synthetic_route_08_focus_04",
        "synthetic_route_08_focus_05",
        "synthetic_route_08_focus_06",
        "synthetic_route_08_focus_07",
        "synthetic_route_08_focus_08",
        "synthetic_route_08_focus_09",
        "synthetic_route_08_focus_10",
        "synthetic_route_08_focus_11",
        "synthetic_route_08_focus_12",
        "synthetic_route_08_focus_13",
        "synthetic_route_08_focus_14",
        "synthetic_route_08_focus_15",
        "synthetic_route_08_focus_16",
        "synthetic_route_08_focus_17",
        "synthetic_route_08_focus_18",
        "synthetic_route_08_focus_19",
        "synthetic_route_08_focus_20",
        "synthetic_route_08_focus_21",
        "synthetic_route_08_focus_22",